{
  "id": "algebra-integers-ops-v1",
  "title": "Integers & Operations",
  "version": 1,
  "status": "draft",
  "estimatedMinutes": 12,
  "sections": [
    {
      "type": "mcq",
      "prompt": "Which expression equals -3 + 5?",
      "choices": ["-8", "2", "-2", "8"],
      "correctIndex": 1,
      "rationales": ["", "Adding 5 to -3 gives 2", "", ""]
    },
    {
      "type": "notebook_gate",
      "prompt": "In your notebook, compute 12 - 19. Show steps.",
      "reflection": { "placeholder": "Write what you noticedâ€¦" }
    },
    {
      "type": "short_answer",
      "prompt": "Solve: x + 7 = 12",
      "rubric": ["Shows inverse operation", "States x = 5"],
      "answer": "5"
    },
    {
      "type": "interactive_explore",
      "pattern": "number_line_slider",
      "config": { "min": -10, "max": 10, "target": 2 }
    }
  ]
}


